KeyName,ID,Label_KR,Detail_KR,Option_KR,Label_EN,Detail_EN,Option_EN,Label_JP,Detail_JP,Option_JP
,,,,,,,,,,
0~999 monster,,,,,,,,,,
,1,슬라임,자세히 보면 의외로 귀여운 슬라임입니다. 약하긴 하지만 성장가능성이 높은 몬스터입니다.," @Op1::진화 힌트 : 최대 레벨 달성 후 길드게시판을 확인::Op1 @Op2::슬라임 헌터 처치::Op2",Slime,It's a surprisingly cute slime if you look closely. It's weak- but it's a monster with high potential for growth.," @Op1::Evolution Hint: Check the guild board after maxing out::Op1 @Op2::Slay Slime Hunter::Op2",スライム,よく見るとかわいらしいスライムです。弱いですが、成長の可能性が高いモンスターです。," @Op1::進化ヒント：最大レベル達成後、ギルド掲示板を確認::Op1 @Op2::スライムハンター討伐::Op2"
,2,어스골렘,던전에 마나를 융합해 창조해낸 골렘입니다. 튼튼하고 강해서 모험가들을 상대로 제격이에요. 하지만 조금 한계가 있을지도?," @Op1::진화 힌트 : 최대 레벨 달성 후 길드게시판을 확인::Op1 @Op2::도적 처치::Op2",EarthGolem,It's a golem created by fusing the Dungeon's mana. It's sturdy and strong- perfect for facing adventurers. But it might have some limitations?," @Op1::Evolution Hint: Check the guild board after maxing out::Op1 @Op2::Slay Bandits::Op2",アースゴーレム,ダンジョンにマナを融合させて創造されたゴーレムです。頑丈で強いので、冒険者相手に適していますが、少し限界があるかもしれません。," @Op1::進化ヒント：最大レベル達成後、ギルド掲示板を確認::Op1 @Op2::盗賊退治::Op2"
,3,머쉬보이,어둡고 습한곳을 좋아하는 버섯몬스터입니다. 높은 공격력을 지녔어요.,,MushBoy,It's a mushroom monster that loves dark and humid places. It has high attack power.,,マッシュボーイ,暗くて湿った場所を好むキノコモンスターです。高い攻撃力を持っています。,
,4,이블아이,매력적인 눈을 지닌 몬스터에요. 생김새때문에 피부가 약할 것 같지만- 실은 엄청 단단하기 때문에 수비용으로 적절합니다.,,EvilEye,It's a monster with captivating eyes. Its appearance might make it seem fragile- but it's actually extremely tough- making it suitable for defense.,,イービルアイ,魅力的な目を持つモンスターです。見た目から皮膚が弱そうに見えますが、実は非常に硬いので、防御用に適しています。,
,5,페어리,순수한 마나의 결정체인 요정 몬스터입니다. 여러방면에서 좋은 밸런스를 가지고 있고- 잠재력도 높은 편입니다.,,Fairy,It's a fairy monster- a pure crystallization of mana. It has a good balance in many areas- and high potential.,,フェアリー,純粋なマナの結晶である妖精モンスターです。様々な面でバランスが良く、潜在能力も高めです。,
,6,살라만드라,원시적인 형태를 지닌 몬스터입니다. 불을 내뿜어 적을 공격합니다. 종족 특성으로 적을 위압하여 빨리 지치게 만들어요.,,Salamandra,It's a monster with a primitive form. It breathes fire to attack enemies. Its racial trait allows it to intimidate enemies and make them tire quickly.,,サラマンダー,原始的な形態を持つモンスターです。火を吐いて敵を攻撃します。種族特性で敵を威圧し、早く疲れさせます。,
,7,그레이하운드,친근감이 느껴지는 늑대형 몬스터입니다. 매우 용맹하고 재빠른 몸놀림을 지녔어요.,,GreyHound,It's a friendly wolf-like monster. It's very brave and agile.,,グレイハウンド,親しみやすい狼型モンスターです。非常に勇敢で素早い動きを持っています。,
,,,,,,,,,,
,20,서큐버스,아름다운 모습으로 꿈 속에 나타나 정기를 빼앗는다고 알려진 몬스터입니다.,,Succubus,"A monster known to appear in dreams with beautiful form, stealing life essence.",,サキュバス,美しい姿で夢の中に現れ、精気を奪うと言われるモンスターです。,
,,,,,,,,,,
,77,라비,신비로운 힘을 가진 생명체. 아무도 본 적 없는 몬스터라고 합니다.,,Rabi,,,ラヴィ,,
,,,,,,,,,,
,,,,,,,,,,
,501,블러디 슬라임,슬라임의 진화 형태인 블러디 슬라임입니다. 겉으로 보기엔 비슷해 보여도 상당히 강력해졌습니다.,,Bloody Slime,It's the evolved form of a slime- a Bloody Slime. It may look similar on the outside- but it has become considerably more powerful.,,ブラッディスライム,スライムの進化形態であるブラッディスライムです。外見は似ていても、かなり強力になっています。,
,502,플레임 골렘,어스 골렘의 진화 형태인 플레임 골렘입니다. 더 튼튼하고 더 강해졌습니다.,,FlameGolem,It's the evolved form of an Earth Golem- a Flame Golem. It's even sturdier and stronger.,,フレイムゴーレム,アースゴーレムの進化形態であるフレイムゴーレムです。より頑丈で、より強くなっています。,
,,,,,,,,,,
,506,샐린느,살라만드라가 진화한 형태. 어째서인지 두발로 걸을 수 있습니다. 보기와는 다르게 상당히 강합니다.,,Salinu,,,サリーヌ,,
,,,,,,,,,,
,,,,,,,,,,
,991,초보자 던전 마스터,모험레벨은 낮아도 던전 지식은 상당한 편이에요.,,Novice Dungeon Master,Their adventure level is low- but they have quite a bit of Dungeon knowledge.,,見習いダンジョンマスター,冒険レベルは低くてもダンジョンの知識はかなりのものです。,
,992,초보자 던전 마스터,모험레벨은 낮아도 던전 지식은 상당한 편이에요.,,Novice Dungeon Master,Their adventure level is low- but they have quite a bit of Dungeon knowledge.,,見習いダンジョンマスター,冒険レベルは低くてもダンジョンの知識はかなりのものです。,
,993,초보자 던전 마스터,모험레벨은 낮아도 던전 지식은 상당한 편이에요.,,Novice Dungeon Master,Their adventure level is low- but they have quite a bit of Dungeon knowledge.,,見習いダンジョンマスター,冒険レベルは低くてもダンジョンの知識はかなりのものです。,
,,,,,,,,,,
,,,,,,,,,,
,,,,,,,,,,
,,,,,,,,,,
,,,,,,,,,,
1000~1999 npc,,,,,,,,,,
,1000,약초꾼,던전에서 나오는 약초나 풀들을 채취해서 마을과 길드에 공급해주는 역할을 합니다.,,Herbalist,They gather herbs and plants from the Dungeon and supply them to the village and guild.,,薬草採集人,ダンジョンで生える薬草や草を採取し、町やギルドに供給する役割を果たします。,
,1001,베테랑 약초꾼,약초꾼을 업으로 오랜기간 일한 숙련자입니다.,,Veteran Herbalist,An experienced herbalist who has been in the profession for a long time.,,ベテラン薬草採集人,長期間薬草採集を生業としてきた熟練者です。,
,,,,,,,,,,
,1100,광부,던전에서 생성되는 다양한 광물을 캐내서 마을과 길드에 공급해주는 역할을 합니다.,,Miner,They mine various minerals generated in the Dungeon and supply them to the village and guild.,,鉱夫,ダンジョンで生成される様々な鉱物を採掘し、町やギルドに供給する役割を果たします。,
,1101,베테랑 광부,광물캐기 숙련자입니다. 더 오래 효율적으로 일 할 수 있습니다.,,Veteran Miner,An experienced miner. They can work more efficiently for longer periods.,,ベテラン鉱夫,鉱物採掘の熟練者です。より長時間効率的に作業ができます。,
,,,,,,,,,,
,1200,초보 모험가,모험가가 된지 얼마 안된 새내기 모험가입니다. 나름 모험가라서 자원보단 몬스터와 보물에 관심이 있습니다.,,Adventurer,They recently became an adventurer. As an adventurer- they're more interested in monsters and treasure than resources.,,駆け出し冒険者,冒険者になってからあまり経っていない新米冒険者です。冒険者なりに資源よりもモンスターと宝物に関心があります。,
,1201,이름있는 모험가,꽤 이름있는 모험가입니다. 전투 능력과 상황판단 능력 등 새내기 모험가와는 비교할 수 없어요.,,Experienced Adventurer,They're a quite famous adventurer. Their combat abilities and situational judgment are incomparable to novice adventurers.,,名の知れた冒険者,かなり名の知れた冒険者です。戦闘能力や状況判断能力など、新米冒険者とは比べ物になりません。,
,,,,,,,,,,
,1300,엘프,자연에 살고 마나 친화력이 높은 종족입니다. 약초에 관한 지식이 많으며 기본적인 전투력도 갖추고 있습니다.,,Elf,They're a race that lives in nature and has a high affinity for mana. They have extensive knowledge about herbs and possess basic combat abilities.,,エルフ,自然に生き、マナ親和性の高い種族です。薬草に関する知識が豊富で、基本的な戦闘力も備えています。,
,,,,,,,,,,
,1400,위저드,마법과 물질- 기타 흥미로운 것들을 탐구하는 마법사입니다. 마법의 파괴력이 높기 때문에 상당히 위험합니다.,,Wizard,A wizard who explores magic- matter- and other interesting things. Their magic is highly destructive- making them quite dangerous.,,ウィザード,魔法と物質、その他興味深いものを探求する魔法使いです。魔法の破壊力が高いため、非常に危険です。,
,,,,,,,,,,
,1800,슬라임 헌터,길드의 퀘스트를 받고 출동한 몬스터 헌터,,Slime Hunter,A monster hunter dispatched by the guild to take on a quest,,スライムハンター,ギルドのクエストを受けて出動したモンスターハンター,
,1801,뒷골목 도적,길드에서 골렘의 핵이 비싼값에 거래된다는 것을 듣고 온 뒷골목 출신 도적,,Back Alley Bandits,A back-alley thug who came after hearing that the guild is buying Golem cores at a premium,,裏路地の盗賊,ギルドでゴーレムの核が高値で取引されていると聞いて来た裏路地出身の盗賊,
,,,,,,,,,,
,,,,,,,,,,
,1903,새내기 모험가,방금 모험가가 된 새내기 모험가입니다. 나름 모험가라서 자원보단 몬스터와 보물에 관심이 있습니다.,,Newbie adventures,They recently became an adventurer. As an adventurer- they're more interested in monsters and treasure than resources.,,新米冒険者,冒険者になったばかりの新米です。冒険者なりに資源よりもモンスターと宝物に関心があります。,
,,,,,,,,,,
,1908,혈기왕성한 모험가,초보자 던전을 답파하여 스승의 인정을 받으려하는 모험가,,Bloodthirsty Adventurer,An adventurer trying to earn their master's recognition by conquering the Novice Dungeon,,血気盛んな冒険者,初心者ダンジョンを踏破して師匠の認定を得ようとする冒険者,
,,,,,,,,,,
,1910,고블린,던전의 모든 자원을 탐내는 고블린입니다.,,Goblin,A goblin coveting all resources in the dungeon.,,ゴブリン,ダンジョンの全ての資源を欲しがるゴブリンです。,
,1911,욕심많은 고블린,던전의 모든 자원을 탐내는 고블린입니다.,,Greedy Goblin,A goblin coveting all resources in the dungeon.,,欲張りゴブリン,ダンジョンの全ての資源を欲しがるゴブリンです。,
,1912,탐욕스런 고블린,던전의 모든 자원을 탐내는 고블린입니다.,,Avaricious Goblin,A goblin coveting all resources in the dungeon.,,強欲なゴブリン,ダンジョンの全ての資源を欲しがるゴブリンです。,
,,,,,,,,,,
,1914,던전의 재앙,어디선가 나타난 정체 모를 생명체. 던전의 모든 것을 파괴한다.,,Catastrophe of the dungeon,a mysterious creature that appeared out of nowhere. It destroys everything in the dungeon.,,ダンジョンの災厄,どこからか現れた正体不明の生命体。ダンジョンの全てを破壊する。,
,1915,은퇴한 영웅,던전을 조사하러온 과거 영웅 출신의 모험가,,Retired Heroes,A former legendary adventurer who has come to investigate the Dungeon,,引退した英雄,ダンジョンを調査しに来た過去の英雄出身の冒険者,
,,,,,,,,,,
,1920,피의 노래 리더,유명한 파티 피의 노래의 리더 겸 검사입니다.,,BloodSong Leader,Famous party BloodSong's leader and swordsman.,,ブラッドソングのリーダー,有名なパーティー「ブラッドソング」のリーダー兼剣士です。,
,1921,피의 노래 수호자,유명한 파티 피의 노래의 전위를 담당하는 수호자입니다.,,BloodSong Guardian,Famous party BloodSong's vanguard guardian.,,ブラッドソングの守護者,有名なパーティー「ブラッドソング」の前衛を担当する守護者です。,
,1922,피의 노래 위저드,유명한 파티 피의 노래의 공격을 담당하는 위저드입니다.,,BloodSong Wizard,Famous party BloodSong's attacking wizard.,,ブラッドソングのウィザード,有名なパーティー「ブラッドソング」の攻撃を担当するウィザードです。,
,1923,피의 노래 레인저,유명한 파티 피의 노래의 후위을 담당하는 레인저입니다.,,BloodSong Ranger,Famous party BloodSong's rearguard ranger.,,ブラッドソングのレンジャー,有名なパーティー「ブラッドソング」の後衛を担当するレンジャーです。,
,1924,피의 노래 리더,유명한 파티 피의 노래의 리더 겸 검사입니다.,,BloodSong Leader,Famous party BloodSong's leader and swordsman.,,ブラッドソングのリーダー,有名なパーティー「ブラッドソング」のリーダー兼剣士です。,
,1925,피의 노래 수호자,유명한 파티 피의 노래의 전위를 담당하는 수호자입니다.,,BloodSong Guardian,Famous party BloodSong's vanguard guardian.,,ブラッドソングの守護者,有名なパーティー「ブラッドソング」の前衛を担当する守護者です。,
,1926,피의 노래 위저드,유명한 파티 피의 노래의 공격을 담당하는 위저드입니다.,,BloodSong Wizard,Famous party BloodSong's attacking wizard.,,ブラッドソングのウィザード,有名なパーティー「ブラッドソング」の攻撃を担当するウィザードです。,
,1927,피의 노래 레인저,유명한 파티 피의 노래의 후위을 담당하는 레인저입니다.,,BloodSong Ranger,Famous party BloodSong's rearguard ranger.,,ブラッドソングのレンジャー,有名なパーティー「ブラッドソング」の後衛を担当するレンジャーです。,
,,,,,,,,,,
,1930,길드 간부,길드에서 파견한 조사단의 분대장입니다.,,Guild Officer,The squad leader of the investigation team dispatched from the guild.,,ギルド幹部,ギルドから派遣された調査団の分隊長です。,
,1931,길드 간부,길드에서 파견한 조사단의 분대장입니다.,,Guild Officer,The squad leader of the investigation team dispatched from the guild.,,ギルド幹部,ギルドから派遣された調査団の分隊長です。,
,1932,영웅 [블루나이트],길드에서 파견한 조사단의 총대장입니다. 현재의 영웅이며 [블루나이트] 라고 불립니다.,,Hero [BlueKnight],The commander in chief of the investigation team dispatched from the guild. The current hero- and called [BlueKnight].,,英雄［ブルーナイト］,ギルドから派遣された調査団の総隊長です。現在の英雄であり、［ブルーナイト］と呼ばれています。,
,,,,,,,,,,
,1941,길드 병사,길드에서 파견한 조사단의 병사입니다.,,Guild Soldier,A soldier of the investigation team dispatched from the guild.,,ギルド兵士,ギルドから派遣された調査団の兵士です。,
,1942,길드 전투원,길드에서 파견한 조사단의 전투원입니다. 병사보다 좀 더 전투 경험이 많습니다.,,Guild Combatant,A combatant of the investigation team dispatched from the guild. More battle experience than soldiers.,,ギルド戦闘員,ギルドから派遣された調査団の戦闘員です。兵士よりも戦闘経験が豊富です。,
,1943,길드 정예병,길드에서 파견한 조사단의 정예병입니다. 한 명 한 명이 매우 강한 전투력을 가지고 있습니다.,,Guild Elite,An elite of the investigation team dispatched from the guild. Each one has very strong combat power.,,ギルド精鋭兵,ギルドから派遣された調査団の精鋭兵です。一人一人が非常に強い戦闘力を持っています。,
,,,,,,,,,,
,,,,,,,,,,
,,,,,,,,,,
2000~2999 facility_Interaction,,,,,,,,,,
,2000,하급 약초,흔한 약초입니다. 소량이지만 마나를 머금고 있고 던전에서만 얻을 수 있어 인기는 많습니다.,,Lower level herbs,It's a common herb. Although in small quantities- it contains mana and is popular since it can only be obtained from Dungeons.,,下級薬草,一般的な薬草です。少量ですがマナを含んでおり、ダンジョンでしか手に入らないため人気があります。,
,2001,상급 약초,꽤 귀한 약초입니다. 고급 포션의 재료로 사용된다고 하네요.,,High level herbs,It's a quite rare herb. It's said to be used as an ingredient for high-grade potions.,,上級薬草,かなり貴重な薬草です。高級ポーションの材料として使用されるそうです。,
,2002,마나 무,마나를 지닌 무입니다. 최고급 식재료로 사용되며 기타 여러 합성에도 사용됩니다.,,Mana radish,It's a radish containing mana. It's used as a top-grade food ingredient and in various other compounds.,,マナ大根,マナを宿した大根です。最高級の食材として使用され、その他様々な合成にも使用されます。,
,2003,팔손이,흔한 약초와 비슷하게 생겼지만 자세히보면 8갈래의 잎을 가진 다른 약초입니다. 숙련된 약초꾼만이 제대로 구분할 수 있다고 하네요.,,Fatsia,It looks like a common herb- but if you look closely- it's a different herb with 8-pronged leaves. Only an experienced herbalist can tell the difference.,,ヤツデ,一般的な薬草に似ていますが、よく見ると8本の葉を持つ別の薬草です。熟練した薬草師しか見分けられないそうです。,
,2004,던전 고사리,오래전부터 존재했던 양치식물입니다. 가끔씩 대량으로 발생하여 모험가들의 진행을 막기도 합니다.,,Dungeon fern,An ancient fern that has been around for ages. Occasionally occurs in large numbers- blocking adventurers' progress.,,ダンジョンシダ,古くから存在するシダ植物です。たまに大量に発生し、冒険者の進行を妨げることもあります。,
,2005,활력초,매우 드물게 자라나는 약초입니다. 자양강장제- 활력 포션 등에 사용하며 가치가 높습니다.,,Vigor Herb,A medicinal herb that grows very rarely. It is used in vigor potions and is highly valued.,,活力草,非常に稀に育つ薬草です。滋養強壮剤・活力ポーションなどに使用され、価値が高いです。,
,2006,알로에,"다루기 꽤 어려운 식물이지만 쓰임새는 다양해서 식용, 포션, 약초, 합성 등등 많은 곳에 사용됩니다.",,Aloe,It's a fairly unwieldy plant- but it has many uses- including edibles- potions- herbal medicine- and synthetics.,,アロエ,かなり扱いにくい植物ですが、用途は様々で、食用、ポーション、薬草、合成など様々なところで使われています。,
,,,,,,,,,,
,,,,,,,,,,
,2100,흔한 바위,흔한 던전의 바위입니다. 그렇지만 지상의 바위와는 완전히 다른 물질이에요.,,Common Rock,It's a common rock from the Dungeon. But it's a completely different material from rocks on the surface.,,一般的な岩,一般的なダンジョンの岩です。しかし、地上の岩とは全く異なる物質です。,
,2101,모래바위,쉽게 부서져 모래가 되는 바위입니다. 마나를 가지고 있어 쉽게 뭉쳐지고 물과 잘 섞여 쓰임새가 많아요.,,Sandstone,It's a rock that easily crumbles into sand. It contains mana- making it easily moldable and mixable with water- giving it many uses.,,砂岩,簡単に崩れて砂になる岩です。マナを含んでいるため簡単に固まり、水とよく混ざるので用途が多いです。,
,2102,단단한 바위,단단한 바위입니다. 튼튼해서 부수려면 꽤나 많은 체력이 필요할 거에요. 건축재료로 사용되어 인기가 많습니다.,,Hard rock,It's a sturdy rock. It's so tough that you'd need quite a bit of stamina to break it. It's popular as a construction material.,,硬い岩,硬い岩です。頑丈なので壊すにはかなりの体力が必要でしょう。建築材料として使用され、人気があります。,
,2103,마나 철광석,순도가 높은 철을 포함하고 있는 철광석입니다. 무기를 만들 때도 쓰이고 각종 장신구에도 쓰여요.,,Mana Ironstone,It's an iron ore containing high-purity iron. It's used for making weapons and various pieces of jewelry.,,マナ鉄鉱石,純度の高い鉄を含む鉄鉱石です。武器を作る際にも使われ、各種装飾品にも使用されます。,
,2104,석탄,불이 잘 붙는 석탄입니다. 마나를 먹은 석탄은 화력도 유지력도 훨씬 길기 때문에 지상에선 고급 연료입니다.,,Coal,It's a coal that ignites easily. Coal infused with mana has much greater heat output and duration- making it a premium fuel on the surface.,,石炭,火がよく付く石炭です。マナを含んだ石炭は火力も持続力もはるかに長いため、地上では高級燃料です。,
,2105,다이아몬드,매우 귀한 물질인 다이아몬드입니다. 마나의 순도가 높기때문에 마법무기의 핵심 부분이에요. 매우 단단하기 때문에 캐기도 힘들어요.,,Diamond,It's the extremely rare material- diamond. Its high mana purity makes it the core component of magical weapons. It's also extremely hard- making it difficult to mine.,,ダイヤモンド,非常に貴重な物質であるダイヤモンドです。マナの純度が高いため、魔法武器の核心部分に使用されます。非常に硬いため、採掘も困難です。,
,2106,루비,은은한 붉은빛의 내는 루비원석입니다. 장식품이나 관상용으로 많이 거래됩니다.,,Ruby,A ruby gemstone with a faint red glow. Widely traded for ornaments and viewing.,,ルビー,淡い赤色を放つルビー原石です。装飾品や観賞用として多く取引されます。,
,2107,룬스톤,마법 룬 문자가 새겨진 희귀한 원석입니다. 상위 클래스 마법을 위해 꼭 필요한 재료이므로 고가에 거래됩니다.,,Runestone,A rare gemstone engraved with magic rune characters. Essential for higher class magic- so it's traded at a high price.,,ルーンストーン,魔法のルーン文字が刻まれた希少な原石です。上位クラスの魔法に必要不可欠な材料のため、高価で取引されます。,
,2108,크리스탈,투명하고 흠이 적은 맑은 크리스탈입니다. 크기와 형태에 따라 가격이 천차만별이에요.,,Crystal,A clear crystal with few flaws. The price varies greatly depending on the size and shape.,,クリスタル,透明で欠陥の少ないきれいなクリスタルです。大きさや形状によって価格が千差万別です。,
,,,,,,,,,,
,,,,,,,,,,
,2200,골든 소드,금으로 만들어진 검입니다. 보기엔 멋져보이지만 실제 사용은 어렵고 장식용 입니다.,,Golden Sword,A sword made of gold. It looks impressive but is difficult to use and is for decorative purposes.,,ゴールデンソード,金で作られた剣です。見た目は素晴らしいですが、実際の使用は難しく装飾用です。,
,2201,모험가 소드,적당한 무게와 균형으로 실제 사용이 가능한 검입니다.,,Adventurer's Sword,A sword that is actually usable due to its appropriate weight and balance.,,冒険者の剣,適度な重量とバランスで実際に使用できる剣です。,
,2202,불의 칼,불의 기운이 깃든 검입니다.,,Sword of Fire,A sword imbued with the essence of fire.,,炎の剣,炎の気が宿った剣です。,
,2203,독의 칼,독이 묻어있는 검입니다.,,Sword of Poison,A sword coated with poison.,,毒の剣,毒が塗られている剣です。,
,2204,대거,짧지만 매우 날카로운 대거입니다.,,Dagger,A short but very sharp dagger.,,ダガー,短いですが非常に鋭いダガーです。,
,2205,세이버,사용하기 좋아보이는 세이버입니다.,,Saber,A saber that looks easy to use.,,セイバー,使いやすそうなセイバーです。,
,2206,크리스탈 소드,크리스탈로 된 검입니다. 의식용으로 사용됩니다.,,Crystal Sword,A sword made of crystal. It is used for ceremonial purposes.,,クリスタルソード,クリスタルでできた剣です。儀式用に使用されます。,
,,,,,,,,,,
,,,,,,,,,,
,2210,매직 링,모험가들이 던전을 탐색하는 가장 큰 이유가 되는 보물입니다.,,Magic Ring,It's treasure- the biggest reason adventurers explore Dungeons.,,マジックリング,冒険者たちがダンジョンを探索する最大の理由となる宝物です。,
,,,,,,,,,,
